fanyi,title
你难道看不见那黄河之水从天上奔腾而来，波涛翻滚直奔东海，从不再往回流。你难道看不见那年迈的父母，对着明镜悲叹自己的白发，早晨还是满头的黑发，怎么才到傍晚就变成了雪白一片。（所以）人生得意之时就应当纵情欢乐，不要让这金杯无酒空对明月。每个人的出生都一定有自己的价值和意义，黄金千两（就算）一挥而尽，它也还是能够再得来。我们烹羊宰牛姑且作乐，（今天）一次性痛快地饮三百杯也不为多！岑夫子，丹丘生啊！快喝酒吧！不要停下来。让我来为你们高歌一曲，请你们为我倾耳细听：整天吃山珍海味的豪华生活有何珍贵，只希望醉生梦死而不愿清醒。自古以来圣贤无不是冷落寂寞的，只有那会喝酒的人才能够留传美名。陈王当年宴设平乐观的事迹你可知道，斗酒万千也豪饮，让宾主尽情欢乐。主人呀，你为何说钱不多？只管买酒来让我们一起痛饮。那些什么名贵的五花良马，昂贵的千金狐裘，把你的小儿喊出来，都让他拿去换美酒来吧，让我们一起来消除这无穷无尽的万古长愁！,将进酒
天色黄昏，一群乌鸦落在枯藤缠绕的老树上，发出凄厉的哀鸣。小桥下流水哗哗作响，小桥边庄户人家炊烟袅袅。古道上一匹瘦马，顶着西风艰难地前行。夕阳渐渐地失去了光泽，从西边落下。凄寒的夜色里，只有孤独的旅人漂泊在遥远的地方。,天净沙·秋思
明亮的月光洒在床前的窗户纸上，好像地上泛起了一层霜。我禁不住抬起头来，看那天窗外空中的一轮明月，不由得低头沉思，想起远方的家乡。,静夜思
长安沦陷，国家破碎，只有山河依旧；春天来了，人烟稀少的长安城里草木茂密。感伤国事，不禁涕泪四溅，鸟鸣惊心，徒增离愁别恨。连绵的战火已经延续了半年多，家书难得，一封抵得上万两黄金。愁绪缠绕，搔头思考，白发越搔越短，简直要不能插簪了。,春望
水上、陆地上各种草本木本的花，值得喜爱的非常多。晋代的唯独喜爱菊花。从李氏唐朝以来，世人大多喜爱牡丹。我唯独喜爱莲花从积存的淤泥中长出却不被污染，经过清水的洗涤却不显得妖艳。（它的茎）中间贯通外形挺直，不牵牵连连也不枝枝节节，香气传播更加清香，笔直洁净地竖立在水中。（人们）可以远远地观赏（莲），而不可轻易地玩弄它啊。我认为菊花，是花中的隐士；牡丹，是花中的富贵者；莲花，是花中（品德高尚）的君子。啊！（对于）菊花的喜爱，陶渊明以后就很少听到了。（对于）莲花的喜爱，像我一样的还有什么人呢？（对于）牡丹的喜爱，人数当然就很多了!,爱莲说
从小丘向西走一百二十多步，隔着竹林，可以听到水声，就像人身上佩带的佩环相碰击发出的声音，（我）心里感到高兴。砍倒竹子，开辟出一条道路（走过去），沿路走下去看见一个小潭，潭水格外清凉。小潭以整块石头为底，靠近岸边，石底有些部分翻卷过来露出水面。成为了水中高地、小岛、不平的岩石和石岩等各种不同的形状。青翠的树木，翠绿的藤蔓，遮掩缠绕，摇动下垂，参差不齐，随风飘拂。潭中的鱼大约有一百来条，都好像在空中游动，什么依靠都没有。阳光直照（到水底），又,小石潭记
环绕滁州的都是山。那西南的几座山峰，树林和山谷尤其优美。一眼望去树木茂盛，又幽深又秀丽的，那是琅琊山。沿着山路走六七里，渐渐听到潺潺的水声，看到流水从两座山峰之间倾泻而出的，那是酿泉。泉水沿着山峰折绕，沿着山路拐弯，有一座亭子像飞鸟展翅似地，飞架在泉上，那就是醉翁亭。建造这亭子的是谁呢？是山上的和尚智仙。给它取名的又是谁呢？太守用自己的别号（醉翁）来命名。太守和他的宾客们来这儿饮酒，只喝一点儿就醉了；而且年纪又最大，所以自号“醉翁”。醉翁的情趣不在于喝酒，而在欣赏山水的美景。欣赏山水美景的乐趣，领会在心里，寄托在酒上。,醉翁亭记
唐明皇偏好美色，当上皇帝后多年来一直在寻找美女，却都是一无所获。杨家有个女儿刚刚长大，十分娇艳，养在深闺中，外人不知她美丽绝伦。天生丽质、倾国倾城让她很难埋没世间，果然没多久便成为了唐明皇身边的一个妃嫔。她回眸一笑时，千姿百态、娇媚横生；六宫妃嫔，一个个都黯然失色。春寒料峭时，皇上赐她到华清池沐浴，温润的泉水洗涤着凝脂一般的肌肤。侍女搀扶她，如出水芙蓉软弱娉婷，由此开始得到皇帝恩宠。鬓发如云颜脸似花，头戴着金步摇。温暖的芙蓉帐里，与皇上共度春宵。情深只恨春宵短，一觉睡到太阳高高升起。君王深恋儿女情温柔乡，从此再也不早朝。承受君欢侍君饮，忙得没有闲暇。春日陪皇上一起出游，晚上夜夜侍寝。后宫中妃嫔不下三千人，却只有她独享皇帝的恩宠。金屋中梳妆打扮，夜夜撒娇不离君王；玉楼上酒酣宴罢，醉意更添几许风韵。兄弟姐妹都因她列土封侯，杨家门楣光耀令人羡慕。于是使得天下的父母都改变了心意，变成重女轻男。骊山上华清宫内玉宇琼楼高耸入云，清风过处仙乐飘向四面八方。轻歌曼舞多合拍，管弦旋律尽传神，君王终日观看，却百看不厌。渔阳叛乱的战鼓震耳欲聋，宫中停奏霓裳羽衣曲。九重宫殿霎时尘土飞扬，君王带着大批臣工美眷向西南逃亡。车队走走停停，西出长安才百余里。六军停滞不前，要求赐死。君王无可奈何，只得在马嵬坡下缢杀杨玉环。贵妃头上的饰品，抛撒满地无人收拾。翠翘金雀玉搔头，珍贵头饰一根根。君王欲救不能，掩面而泣，回头看贵妃惨死的场景，血泪止不住地流。秋风萧索扫落叶，黄土尘埃已消遁，回环曲折穿栈道，车队踏上了剑阁古道。峨眉山下行人稀少，旌旗无色，日月无光。蜀地山清水秀，引得君王相思情。行宫里望月满目凄然，雨夜听曲声声带悲。叛乱平息后，君王重返长安，路过马嵬坡，睹物思人，徘徊不前。萋萋马嵬坡下，荒凉黄冢中，佳人容颜再不见，唯有坟茔躺山间。君臣相顾，泪湿衣衫，东望京都心伤悲，信马由缰归朝堂。回来一看，池苑依旧，太液池边芙蓉仍在，未央宫中垂柳未改。芙蓉开得像玉环的脸，柳叶儿好似她的眉，此情此景如何不心生悲戚?春风吹开桃李花，物是人非不胜悲；秋雨滴落梧桐叶，场面寂寞更惨凄。兴庆宫和甘露殿，处处萧条，秋草丛生。宫内落叶满台阶，长久不见有人扫。戏子头已雪白，宫女红颜尽褪。晚上宫殿中流萤飞舞，孤灯油尽君王仍难以入睡。细数迟迟钟鼓声，愈数愈觉夜漫长。遥望耿耿星河天，直到东方吐曙光。鸳鸯瓦上霜花重生，冰冷的翡翠被里谁与君王同眠?阴阳相隔已一年，为何你从未在我梦里来过?临邛道士正客居长安，据说他能以法术招来贵妃魂魄。君王思念贵妃的情意令他感动。他接受皇命，不敢怠慢，殷勤地寻找，八面御风。驾驭云气入空中，横来直去如闪电，升天入地遍寻天堂地府，都毫无结果。忽然听说海上有一座被白云围绕的仙山。玲珑剔透楼台阁，五彩祥云承托起。天仙神女数之不尽，个个风姿绰约。当中有一人字太真，肌肤如雪貌似花，好像就是君王要找的杨贵妃。道士来到金阙西边，叩响玉石雕做的院门轻声呼唤，让小玉叫侍女双成去通报。太真听说君王的使者到了，从帐中惊醒。穿上衣服推开枕头出了睡帐。逐次地打开屏风放下珠帘。半梳着云鬓刚刚睡醒，来不及梳妆就走下坛来，还歪带着花冠。轻柔的仙风吹拂着衣袖微微飘动，就像霓裳羽衣的舞姿，袅袅婷婷。寂寞忧愁颜，面上泪水长流，犹如春天带雨的梨花。含情凝视天子使，托他深深谢君王。马嵬坡上长别后，音讯颜容两渺茫。昭阳殿里的姻缘早已隔断，蓬莱宫中的孤寂，时间还很漫长。回头俯视人间，长安已隐，只剩尘雾。只有用当年的信物表达我的深情，钿盒金钗你带去给君王做纪念。金钗留下一股，钿盒留下一半，金钗劈开黄金，钿盒分了宝钿。但愿我们相爱的心，就像黄金宝钿一样忠贞坚硬，天上人间总有机会再见。临别殷勤托方士，寄语君王表情思，语中誓言只有君王与我知。当年七月七日长生殿中，夜半无人，我们共起山盟海誓。在天愿为比翼双飞鸟，在地愿为并生连理枝。即使是天长地久，也总会有尽头，但这生死遗恨，却永远没有尽期。,长恨歌
我愤怒得头发竖了起来，帽子被顶飞了。独自登高凭栏远眺，骤急的风雨刚刚停歇。抬头远望天空，禁不住仰天长啸，一片报国之心充满心怀。三十多年来虽已建立一些功名，但如同尘土微不足道，南北转战八千里，经过多少风云人生。好男儿，要抓紧时间为国建功立业，不要空空将青春消磨，等年老时徒自悲切。靖康之变的耻辱，至今仍然没有被雪洗。作为国家臣子的愤恨，何时才能泯灭！我要驾着战车向贺兰山进攻，连贺兰山也要踏为平地。我满怀壮志，打仗饿了就吃敌人的肉，谈笑渴了就喝敌人的鲜血。待我重新收复旧日山河，再带着捷报向国家报告胜利的消息！,满江红·写怀
江南清明时节细雨纷纷飘洒，路上羁旅行人个个落魄断魂。借问当地之人何处买酒浇愁？牧童笑而不答遥指杏花山村。,清明
风和日丽游春在泗水之滨，无边无际的风光焕然一新。谁都可以看出春天的面貌，春风吹得百花开放、万紫千红，到处都是春天的景致。,春日
庆历四年的春天，滕子京被降职到巴陵郡做太守。到了第二年，政事顺利，百姓和乐，各种荒废的事业都兴办起来了。于是重新修建岳阳楼，扩大它原有的规模，把唐代名家和当代人的诗赋刻在它上面。嘱托我写一篇文章来记述这件事情。,岳阳楼记
在三峡七百里之间，两岸都是连绵的高山，完全没有中断的地方；重重叠叠的悬崖峭壁，遮挡了天空和太阳。若不是在正午半夜的时候，连太阳和月亮都看不见。,三峡
阵阵轰鸣的爆竹声中，旧的一年已经过去；和暖的春风吹来了新年，人们欢乐地畅饮着新酿的屠苏酒。初升的太阳照耀着千家万户，他们都忙着把旧的桃符取下，换上新的桃符。,元日
苦苦地寻寻觅觅，却只见冷冷清清，怎不让人凄惨悲戚。乍暖还寒的时节，最难保养休息。喝三杯两杯淡酒，怎么能抵得住早晨的寒风急袭？一行大雁从眼前飞过，更让人伤心，因为都是旧日的相识。园中菊花堆积满地，都已经憔悴不堪，如今还有谁来采摘？冷清清地守着窗子，独自一个人怎么熬到天黑？梧桐叶上细雨淋漓，到黄昏时分，还是点点滴滴。这般情景，怎么能用一个“愁”字了结！,声声慢·寻寻觅觅
八月里秋深，狂风怒号，狂风卷走了我屋顶上好几层茅草。茅草乱飞，渡过浣花溪，散落在对岸江边。飞得高的茅草缠绕在高高的树梢上，飞得低的飘飘洒洒沉落到池塘和洼地里。南村的一群儿童欺负我年老没力气，竟忍心这样当面做“贼”抢东西，毫无顾忌地抱着茅草跑进竹林去了。我嘴唇干燥也喝止不住，回来后拄着拐杖，独自叹息。一会儿风停了，天空中乌云像墨一样黑，深秋天空阴沉迷蒙渐渐黑下来了。布被盖了多年，又冷又硬，像铁板似的。孩子睡觉姿势不好，把被子蹬破了。一下雨屋顶漏水，屋内没有一点儿干燥的地方，房顶的雨水像麻线一样不停地往下漏。自从安史之乱之后，我睡眠的时间很少，长夜漫漫，屋漏床湿，怎能挨到天亮。如何能得到千万间宽敞高大的房子，普遍地庇覆天下间贫寒的读书人，让他们开颜欢笑，房子在风雨中也不为所动，安稳得像是山一样？唉！什么时候眼前出现这样高耸的房屋，到那时即使我的茅屋被秋风所吹破，我自己受冻而死也心甘情愿！,茅屋为秋风所破歌
山不在于高，有了神仙就出名。水不在于深，有了龙就显得有了灵气。这是简陋的房子，只是我（住屋的人）品德好（就感觉不到简陋了）。长到台阶上的苔痕颜色碧绿；草色青葱，映入帘中。到这里谈笑的都是知识渊博的大学者，交往的没有知识浅薄的人，可以弹奏不加装饰的古琴，阅读佛经。没有奏乐的声音扰乱双耳，没有官府的公文使身体劳累。南阳有的草庐，西蜀有扬子云的亭子。孔子说：有什么简陋的呢?,陋室铭
北风席卷大地把白草吹折，胡地天气八月就纷扬落雪。忽然间宛如一夜春风吹来，好像是千树万树梨花盛开。雪花散入珠帘打湿了罗幕，狐裘穿不暖锦被也嫌单薄。将军都护手冻得拉不开弓，铁甲冰冷得让人难以穿着。沙漠结冰百丈纵横有裂纹，万里长空凝聚着惨淡愁云。主帅帐中摆酒为归客饯行，胡琴琵琶羌笛合奏来助兴。傍晚辕门前大雪落个不停，红旗冻僵了风也无法牵引。轮台东门外欢送你回京去，你去时大雪盖满了天山路。山路迂回曲折已看不见你，雪上只留下一行马蹄印迹。,白雪歌送武判官归京
大江浩浩荡荡向东流去，滔滔巨浪淘尽千古英雄人物。那旧营垒的西边，人们说那就是三国周瑜鏖战的赤壁。陡峭的石壁直耸云天，如雷的惊涛拍击着江岸，激起的浪花好似卷起千万堆白雪。雄壮的江山奇丽如图画，一时间涌现出多少英雄豪杰。遥想当年的周瑜春风得意，绝代佳人小乔刚嫁给他，他英姿奋发豪气满怀。手摇羽扇头戴纶巾，谈笑之间，强敌的战船烧得灰飞烟灭。我今日神游当年的战地，可笑我多情善感，过早地生出满头白发。人生犹如一场梦，且洒一杯酒祭奠江上的明月。,念奴娇·赤壁怀古
回想我早年由科举入仕历尽辛苦，如今战火消歇已熬过了四个年头。国家危在旦夕恰如狂风中的柳絮，个人又哪堪言说似骤雨里的浮萍。惶恐滩的惨败让我至今依然惶恐，零丁洋身陷元虏可叹我孤苦零丁。人生自古以来有谁能够长生不死？我要留一片爱国的丹心映照史册。,过零丁洋
驿站之外的断桥边，梅花孤单寂寞地绽开了花，无人过问。暮色降临，梅花无依无靠，已经够愁苦了，却又遭到了风雨的摧残。梅花并不想费尽心思去争艳斗宠，对百花的妒忌与排斥毫不在乎。即使凋零了，被碾作泥土，又化作尘土了，梅花依然和往常一样散发出缕缕清香。,卜算子·咏梅
这年的时光什么时候才能了结，往事知道有多少！昨夜小楼上又吹来了春风，在这皓月当空的夜晚，怎承受得了回忆故国的伤痛。精雕细刻的栏杆、玉石砌成的台阶应该还在，只是所怀念的人已衰老。要问我心中有多少哀愁，就像这不尽的滔滔春水滚滚东流。,虞美人·春花秋月何时了
东行登上碣石山，来观赏那苍茫的海。海水多么宽阔浩荡，山岛高高地挺立在海边。树木和百草丛生，十分繁茂，秋风吹动树木发出悲凉的声音，海中涌着巨大的海浪。太阳和月亮的运行，好像是从这浩瀚的海洋中发出的。银河星光灿烂，好像是从这浩瀚的海洋中产生出来的。我很高兴，就用这首诗歌来表达自己内心的志向。,步出夏门行·观沧海
鲁庄公十年的春天，齐国军队攻打我们鲁国。鲁庄公将要迎战。曹刿请求拜见鲁庄公。他的同乡说：“当权的人自会谋划这件事，你又何必参与呢？”曹刿说：“当权的人目光短浅，不能深谋远虑。”于是入朝去见鲁庄公。曹刿问：“您凭借什么作战？”鲁庄公说：“衣食（这一类）养生的东西，我从来不敢独自专有，一定把它们分给身边的大臣。”曹刿回答说：“这种小恩小惠不能遍及百姓，老百姓是不会顺从您的。”鲁庄公说：“祭祀用的猪牛羊和玉器、丝织品等祭品，我从来不敢虚报夸大数目，一定对上天说实话。”曹刿说：“小小信用，不能取得神灵的信任，神灵是不会保佑您的。”鲁庄公说：“大大小小的诉讼案件，即使不能一一明察，但我一定根据实情（合理裁决）。”曹刿回答说：“这才尽了本职一类的事，可以（凭借这个条件）打一仗。如果作战，请允许我跟随您一同去。”,曹刿论战
译文好雨似乎会挑选时辰，降临在万物萌生之春。伴随和风，悄悄进入夜幕。细细密密，滋润大地万物。浓浓乌云，笼罩田野小路，点点灯火，闪烁江上渔船。明早再看带露的鲜花，成都满城必将繁花盛开。,春夜喜雨
泉眼悄然无声是因舍不得细细的水流，树荫倒映水面是喜爱晴天和风的轻柔。娇嫩的小荷叶刚从水面露出尖尖的角，早有一只调皮的小蜻蜓立在它的上头。,小池
风和烟都消散了，天和山变成相同的颜色。（我乘着船）随着江流漂荡，随意的向东或向西漂流。从富阳到桐庐，一百里左右，奇异的山，灵异的水，天下独一无二的。,与朱元思书
高高的柳树长满了翠绿的新叶，轻柔的柳枝垂下来，就像万条轻轻飘动的绿色丝带。这细细的嫩叶是谁的巧手裁剪出来的呢？原来是那二月里温暖的春风，它就像一把灵巧的剪刀。,咏柳 / 柳枝词
从孤山寺的北面到贾亭的西面，湖面春水刚与堤平，白云低垂，同湖面上的波澜连成一片。几处早出的黄莺争着飞向阳光温暖的树木上栖息，谁家新来的燕子衔着泥在筑巢。繁多而多彩缤纷的春花渐渐要迷住人的眼睛，浅浅的春草刚刚能够遮没马蹄。我最喜爱西湖东边的美景，总观赏不够，尤其是绿色杨柳荫下的白沙堤。,钱塘湖春行
老朋友向我频频挥手，告别了黄鹤楼，在这柳絮如烟、繁花似锦的阳春三月去扬州远游。友人的孤船帆影渐渐地远去，消失在碧空的尽头，只看见一线长江，向邈远的天际奔流。,黄鹤楼送孟浩然之广陵
像东风吹散千树繁花一样，又吹得烟火纷纷，乱落如雨。豪华的马车满路芳香。悠扬的凤箫声四处回荡，玉壶般的明月渐渐西斜，一夜鱼龙灯飞舞笑语喧哗。美人头上都戴着亮丽的饰物，笑语盈盈地随人群走过，身上香气飘洒。我在人群中寻找她千百回，猛然一回头，不经意间却在灯火零落之处发现了她。,青玉案·元夕
迷蒙的烟雨，连夜洒遍吴地江天；清晨送走你，孤对楚山离愁无限！朋友啊，洛阳亲友若是问起我来；就说我依然冰心玉壶，坚守信念！,芙蓉楼送辛渐
醉梦里挑亮油灯观看宝剑，梦中回到了当年的各个营垒，接连响起号角声。把烤牛肉分给部下，乐队演奏北疆歌曲。这是秋天在战场上阅兵。战马像的卢马一样跑得飞快，弓箭像惊雷一样，震耳离弦。一心想替君主完成收复国家失地的大业，取得世代相传的美名。可怜已成了白发人！,破阵子·为陈同甫赋壮词以寄之
不要笑农家腊月里酿的酒浊而又浑，在丰收屿年景里待客菜肴非常丰繁。山峦重叠水流曲折正担心无路可走，柳绿花艳忽然眼前又出现一个山村。吹着箫打起鼓春社的日子已经接近，村民们衣冠简朴古代风气仍然保存。今后如果还能乘大好月色出外闲游，我一定拄着拐杖随时来敲你的家门。,游山西村
透过装饰着云母的屏风，烛影渐渐暗淡下去。银河也在静静地消失，晨星沉没在黎明的曙光里。月宫的嫦娥恐怕后悔偷了后羿的长生不老药，现在只有那青天碧海夜夜陪伴着她一颗孤独的心。,嫦娥
金溪有个叫方仲永的百姓，家中世代以耕业。仲永长到五岁时，不曾认识书写工具。忽然有一天仲永哭着索要这些东西。他的父亲对此感到诧异，就向邻居那里把那些东西借来给他。仲永立刻写下了四句，并自己题上自己的名字。这首诗以赡养父母和团结同宗族的人为主旨，给全乡的秀才观赏。从此，指定事物让他作诗，方仲永立刻就能完成，并且诗的文采和道理都有值得欣赏的地方。同县的人们对此都感到非常惊奇，渐渐地都以宾客之礼对待他的父亲，有的人花钱求取仲永的诗。方仲永父亲认为这样有利可图，就每天带领着仲永四处拜访同县的人，不让他学习。,伤仲永
慈母用手中的针线，为远行的儿子赶制身上的衣衫。临行前一针针密密地缝缀，怕的是儿子回来得晚衣服破损。有谁敢说，子女像小草那样微弱的孝心，能够报答得了像春晖普泽的慈母恩情呢？,游子吟
那墙角的几枝梅花，冒着严寒独自盛开。为什么远望就知道洁白的梅花不是雪呢？因为梅花隐隐传来阵阵的香气。,梅花 / 梅
风停了，尘土里带有花的香气，花儿已凋落殆尽。日头已经升的老高，我却懒得来梳妆。景物依旧，人事已变，一切事情都已经完结。想要倾诉自己的感慨，还未开口，眼泪先流下来。听说双溪春景尚好，我也打算泛舟前去。只恐怕双溪蚱蜢般的小船，载不动我许多的忧愁。,武陵春·春晚
