fanyi,title
流离天涯，思绪无穷无已。相逢不久，便又匆匆别离。拉着佳人，只能采一枝暮春的杏花，含泪赠别。你问春天还剩多少，即便春意尚在，又能和谁一同欣赏？三月的隋堤，春水缓缓。此时鸿雁北归，我却要到飞鸿过冬的湖州。回望旧地，清清浅浅的泗水在城下与淮河交汇。想要让泗水寄去相思的千点泪，怎奈它流不到湖州地。,江神子·恨别
弯弯的月儿爬上了凉州城头，城头的月儿升空照着全凉州。凉州方圆七里住着十万人家，这里的胡人半数懂得弹琵琶。动人的琵琶曲令人肝肠欲断，只觉得风声萧萧兮长夜漫漫。河西幕府里我有很多老朋友，老朋友分别以来已有三五春。如今在花门楼前又见到秋草，哪能互相看着在贫贱中变老？人生一世能有几回开怀大笑，今日相逢人人必须痛饮醉倒。,凉州馆中与诸判官夜集
在大海的寒波中，我同倭寇周旋已有十年之久；我站在这里，遥望着京城宫阙。我的心血如同洒在千山万岭上的浓霜，把满山的秋叶都染红了。,望阙台
躺在精美的竹席上，思绪万千，久久不能平静。期待已久的一次与恋人的约会，在这个晚上告吹了。从今以后再也无心欣赏那良辰美景了，管他明月下不下西楼。,写情
在长沙做了三年太傅，有只鸟飞进他的住所。鵩鸟长得很像猫头鹰，是不祥的鸟。贾谊因为被贬到长沙，长沙气候很潮湿，此时看到猫头鹰，认为自己寿命已不长了，于是写了一篇赋来自我安慰。赋文说：,鵩鸟赋
自从高宗皇帝南渡之后，有几个人能真正称得上是治国的行家里手？中原沦陷区的父老乡亲期盼北伐，翘首眺望，南渡的士大夫们也慨叹山河破碎，国土沦陷，半壁河山至今依旧。而那些清谈家们面对大片国土丧失，何曾把收复失地、挽救危局、统一国家放在心上？算起来，我为平定金兵，戎马倥惚，已征战了万里之遥。横枪立马把金人赶走，建功立业，报效祖国，留名青史，这才是真正读书人的事业。韩元吉啊，你是否明白这一点呢？你的文章可以与齐名，被人视为泰山、北斗，你的家世尊贵显赫，门庭前的梧桐成荫，浓密清幽，一定会找来金凤凰。你生来就志在四方。今请看：若生逢其时，遭遇明主，你就回叱风云，显露头脚，大展身手。现在你虽然辞官在家，寄情于绿野堂的景色与平泉庄的草木，纵情于东山上的歌舞诗酒，但古代名相的志趣并未丢，为国捐躯的壮志也并未减。等到将来，有朝一日，你再出山重整社稷，收复中原，完成祖国统一大业之后，我再来为你举杯祝寿。,水龙吟·甲辰岁寿韩南涧尚书
菊花啊，不要说年年盛开花亦好，你也会随着秋日时光的流逝而凋谢。少女的乌发青丝不知岁月的无情，恍若把酒小酌，人若安好花都会随之绽放笑颜。桃树结了多少桃子啊，长满了我家所住的三山岛。什么时候才能跨上回归家乡的鸾凤，人世间沧海浮沉就如一粒微尘一般，都随缘起缘灭最终了结。,醉花阴·黄花谩说年年好
她说过要来的，其实是句空话，一去便杳无影踪。我在楼上等着，直到残月西斜，传来五更的晓钟。因为远别而积思成梦，梦里悲啼，久唤难醒；醒后便匆忙提笔写信，心情急切，墨未磨浓。蜡烛的余光，半罩着饰有金翡翠的帷幕；兰麝的香气，熏染了被褥上刺绣的芙蓉。我像古代的刘郎，本已怨恨蓬山仙境的遥远；我所思念的人啊，哪堪更隔着蓬山千重万重！,无题四首
天亮了，井台上响起了辘轳声。一夜风雨，满阶落花，凋零中透出一丝冷意。在这样一个清晨，“我”和她蓦然相逢。“我”对她一见钟情，却难以明了她迷离的眼波背后暗藏的心事。谁能明白?谁能明白呢?从此以后，无论是在簟席上辗转反侧、孤枕难眠之时，还是独对孤灯、辗转徘徊之际，我都会想念她。,如梦令·正是辘轳金井
楚襄王在兰台宫游玩，由、景差陪同。一阵风飒飒吹来，楚襄王就敞开衣襟迎着吹来的清风说：“这风好爽快呵！这是我与百姓共同享受的吗？”宋玉回答道：“这只是大王享受的风，百姓怎么能与王共同享受它呢！”楚襄王说。“风是天地间流动的空气，它普遍而畅通无阻地吹送过来，不分贵贱高下，都能吹到。现在你却认为只有我才能享受它，难道有什么理由吗？”宋玉答道。“我听老师说，枳树弯曲多叉，就容易招引鸟来作窝。有空洞的地方，风就会吹过来。由于所依托的环境条件不同，风的气势也就不同了。”楚襄王问道：“那风，最初是从哪里生成的呢？”宋玉答道：“风在大地上生成的，从青翠小草尖上兴起，逐渐扩展到山谷，在大山洞口怒吼，沿着大山坳，在松柏林下狂舞。疾风往来不定，形成撞击物体的声音；风势迅疾飘扬，犹如怒火飞腾，风声如雷，风势交错相杂。飞砂走石，大风摧树折木，冲击森林原野。等蓟风势逐渐平息下来，风力微弱，四面散开，只能透进小孔，摇动门栓了。风定尘息之后，景物显得鲜明灿烂，微风渐渐向四面飘散。所以使人感到清凉舒畅的雄风，就飘动升降，凌越高高的城墙，进入深深的王宫。它吹动花草，散发香气，在桂树和椒树之间往来回旋，在疾流的水徊上缓缓飞翔。于是风吹拂水上的荷花，掠过蕙草，分开秦蘅，吹平新夷，覆盖在初生的草木之上，它急剧回旋冲击山陵，致使各种芳草香花凋零殆尽。然后风就在院子里徘徊，向北吹进宫室，上升到丝织的帷帐里，进入深邃的内室，这才成为大王的风了。所以那种风吹到人身上，其情状简直凄凉、寒冷得很，清凉的冷风使人为之感叹。清清凉凉的，既能治病，又可解酒，使人耳聪目明，身心安宁，这就是所说的唯大王所有的雄风呀！”楚襄王说。“你对这件事解说论述得太好了！那么老百姓的风，是不是也可以说给我听听呢？”宋玉回答说：“老百姓的风是从冷落偏僻的小巷中忽然刮起来的，扬起的尘土，烦躁愤懑地回旋盘转，冲击空隙，侵入门户。刮起尘沙，吹散灰堆，搅起污秽肮脏的东西，扬起腐烂的垃圾，歪歪斜斜逼近用破瓮口做的窗户，一直吹到百姓住的草屋里。所以那种风吹到人身上，其情状简直令人心烦意乱，忧郁苦闷，受到闷热之气，得了湿病，使人内心愁昔，生病发烧。风吹到嘴唇上就生唇疮，吹刭眼睛上就使得眼睛红肿，受风得病后使人嘴巴抽搐，咬牙吮咂、大叫，陷于半死不活状态。这就是所讲的老百姓的雌风呀。”,风赋
"杨子的邻人走失了一只羊。那人央请了许多亲戚朋友一道去寻找（丢失的羊），又请杨子的家僮也一同去追捕。杨子说：""唉！走失了一只羊，何必要这么多人去寻找呢？""邻人说：""因为岔路太多了！""杨子的家僮回来后，杨子问：""找到羊了吗？""邻居说：""丢掉了！""杨子问：""怎麼会让羊走失呢？""邻居说：""每条岔路的中间又有岔路，我们不知道要往哪条路走，所以只好回来了。""",多歧亡羊
满地凝结着寒霜，浓得像覆上一层白雪。人们立在西风中话别，瘦马也向着残月不断悲鸣。送别时，《阳关》一曲犹未奏完，离人就已出发了。咿轧的车声仿佛应和着歌声，在痛苦地呜咽。天涯芳草青青的颜色已换作枯黄，可是，陌头上深深的车辙依旧是我来时的模样。三句为前人未道之语。静安于是年春跟随罗振玉入京，数月后即奔丧回里。来去匆匆，情事已更，故深感人生之无常。这虚浮无定的人生，还有什么可说呢？在人间最令伤心的事莫过于离别了。,蝶恋花·满地霜华浓似雪
雨绵绵，恨意难消，云层层，愁绪堆积，江南景色，依旧被称为上好美丽。水边村落，湖畔渔市，袅袅升起一缕孤零零的炊烟，那么淡，那么细。一行长途跋涉的鸿雁，在那水天相连的遥远的天际，远远望去，款款飞行，好似列队首尾连缀。回想平生事业，此时此刻，凝视征鸿，谁理会我凭栏远眺的含意！,点绛唇·感兴
在遥远的故乡，曾听过子规鸟凄恻的鸣啼；如今在异乡宣城，又看到盛开的杜鹃花。子规鸣叫悲啭，使人愁肠寸断。暮春三月，这鸟鸣花开的时节，游子正思念他的故乡三巴。,宣城见杜鹃花 / 子规
七夕，阴历七月七日，相传为牛郎渡过银河与织女为一年一度相会。这天晚上，民间陈列瓜果，穿针乞巧。这首诗就是写七夕的。首联：“络角星河菡萏天，一家欢笑设红筵。”角是二十八宿中的角宿，络是网络，当指雾气网络在角宿上。星河，天上的银河，是分离牛郎织女的。菡萏天，是荷花盛开的天气。大概想象牛郎织女在银河边看到角宿和荷花。这是说的天上情景。下句指人间，有一家人家欢笑地在院子里铺置红布的筵席，摆上瓜果，来穿针乞巧。,七夕
沅江的波浪连接着武冈，送你不觉得有离别的伤感。你我一路相连的青山共沐风雨，同顶一轮明月又何曾身处两地呢？,送柴侍御
沉潜的龙，姿态是多么的幽闲多么的美妙啊！高飞的鸿鸟，声音是多么的响亮多么的传远啊！我想要停留在天空（仕进功名），却愧对天上的飞鸿；我想要栖息川谷（隐退沉潜），却惭对深渊的潜龙。我仕进修德，却智慧拙劣；我退隐耕田，却又力量无法胜任。为了追求俸禄，我来到这偏远的海边做官，兼又卧病在床，面对著光秃秃的树林。（每天）蒙著被子，睡著枕头，浑不知季节气候的变化。偶然间揭开窗帷，暂且登楼眺望。倾耳细听有那流水波动的声音，举目眺望有那巍峨高峻的山岭。初春的阳光已经代替了残余的冬风，新来的阳气也更替了去冬的阴冷。（不知不觉）池塘已经长满了春草，园中柳条上的鸣禽也变了种类、换了声音。想起《出车》这首豳诗，真使我伤悲，想到《春草生兮萋萋》这首楚歌，更是让我感慨。唉！独居的生活真容易让人觉得时间难捱、特别长久，而离开群体的处境也真是让人难以安心。坚持节操那里仅仅是古人才做得到呢？所谓的“遯世无闷”今天在我的身上已经验证、实践了。,登池上楼
怎样合成一个“愁”，是离别之人的心上加个秋。纵然是秋雨停歇之后，风吹芭蕉的叶片，也吹出冷气飕飕。别人都说是晚凉时的天气最好，可是我却害怕登上高楼，那明月光下的清景，更加令我滋生忧愁。往昔的种种情事好像梦境一样去悠悠，就像是花飞花谢，就像是滚滚的烟波般向东奔流。群群的燕子已经飞回南方的故乡，只有我这游子还在异地停留。丝丝垂柳不能系住她的裙带，却牢牢地拴住我的行舟。,唐多令·惜别
计时的漏壶在长夜里响起“丁丁”的滴水声，天幕上轻云在缓慢地移动，月亮时而被遮住，时而又露了出来。暗处的秋虫一整夜都在鸣叫着，突然想起还没有给出征作战的丈夫准备寒衣，此时千万不要下霜。,秋夜曲
作者在小序中为读者讲述了一个凄切哀婉的爱情故事。泰和年间，河北大名府有两个青年男女，彼此相恋却遭家人反对，固而愤而投河自尽。后来人们才发现他们在水中的尸体。由于这一爱情悲剧，后来那年的荷花全都并蒂而开，为此鸣情。故事哀婉，令人动情。这首词就是作者闻听此事后，抒发感想，向为争取爱情自由而牺牲的青年男女表示同情，显示作者比较进步开明的思想。此词与《雁丘河》同为姊妹篇。,摸鱼儿·问莲根有丝多少
当年十五二十岁青春之时，徒步就能夺得胡人战马骑。年轻力壮射杀山中白额虎，数英雄岂止邺下的黄须儿？身经百战驰骋疆场三千里，曾以一剑抵当了百万雄师。汉军声势迅猛如惊雷霹雳，虏骑互相践踏是怕遇蒺藜。卫青不败是由于天神辅助，李广无功却缘于命运不济。自被摈弃不用便开始衰朽，世事随时光流逝人成白首。当年象后羿飞箭射雀无目，如今不操弓疡瘤生于左肘。象故侯流落为民路旁卖瓜，学陶令门前种上绿杨垂柳。古树苍茫一直延伸到深巷，寥落空对冷寂的窗牖。誓学耿恭在疏勒祈井得泉，不做颍川灌夫为牢骚酗酒。贺兰山下战士们列阵如云，告急的军书日夜频频传闻。持节使臣去三河招募兵丁，招书令大将军分五路出兵。老将揩试铁甲光洁如雪色，且持宝剑闪动剑上七星纹。愿得燕地的好弓射杀敌将，绝不让敌人甲兵惊动国君。莫嫌当年云中太守又复职，还堪得一战为国建立功勋。,老将行
这连绵不断的雨如同剪不断的哀愁，依稀记得去年我们到杏花园游玩，还一起攀上枝头摘取花枝，比赛谁最轻盈利落。香炉中的熏烟轻轻地萦绕，双袖在炉火映照中泛着紫红的颜色，身着青衫而脸上胀红了酒晕。人间何其广大，竟然还是无处寻觅、亦无处寄托那一份多情。,浣溪沙·伏雨朝寒愁不胜
我辈梦魂经常萦绕着未光复的祖国中原之路。在萧瑟的秋风中，一方面，金兵营垒相连，军号凄厉；另方面，故都汴京的皇宫宝殿已成废墟，禾黍充斥，一片荒凉，真是令人惆怅呵！为什么黄河之源昆仑山的天柱和黄河的中流砥柱都崩溃了，黄河流域各地泛滥成灾？如今，中原人民国破家亡，流离失所。人口密聚的万落千村都变成了狐兔盘踞横行之地。句云：“天意高难问，人情老易悲。”从来是天高难问其意。如今我与君都老了，也容易产生悲情，我们的悲情能向谁倾诉呢?我只能默默地相送到南浦。送君远去！别后，我仍然会伫立江边眺望，不忍离去。见柳枝随风飘起，有些凉意，残暑渐消。夜幕降临，银河横亘高空，疏星淡月，断云缓缓飘动。万里江山，不知君今夜流落到何处？回忆过去与君对床夜语，畅谈心事，情投意合，这情景已不可再得了。俗话说雁断衡阳，君去的地方连大雁也飞不到，写成了书信又有谁可以托付？我辈都是胸襟广阔，高瞻远瞩之人，我们告别时，看的是整个天下，关注的是古今大事，岂肯像小儿女那样只对彼此的恩恩怨怨关心？让我们举起酒杯来，听我唱一支《金缕曲》，送君上路！,贺新郎·送胡邦衡待制赴新州
杨柳飘拂的渡口行客疏疏稀稀，艄公摇荡着船桨一直驶向临圻。只有相思的别恨像无边的春色，不论江南江北时刻送你把家归。,送沈子归江东 / 送沈子福之江东
太尉执事：生性喜好写文章，对此想得很深。我认为文章是气的外在体现，然而文章不是单靠学习就能写好的，气却可以通过培养而得到。孟子说：“我善于培养我的浩然之气。”现在看他的文章，宽大厚重宏伟博大，充塞于天地之间，同他气的大小相衬。走遍天下，广览四海名山大川，与燕、赵之间的英豪俊杰交友，所以他的文章疏放不羁，颇有奇伟之气。这两个人，难道曾经执笔学写这种文章吗？这是因为他们的气充满在内心而溢露到外貌，发于言语而表现为文章，自己却并没有觉察到。苏辙出生已经十九年了。我住在家里时，所交往的，不过是邻居同乡这一类人。所看到的，不过是几百里之内的景物，没有高山旷野可以登临观览以开阔自己的心胸。诸子百家的书，虽然无所不读，但是都是古人过去的东西，不能激发自己的志气。我担心就此而被埋没，所以断然离开家乡，去寻求天下的奇闻壮观，以便了解天地的广大。我经过秦朝、汉朝的故都，尽情观览终南山、嵩山、华山的高峻，向北眺望黄河奔腾的急流，深有感慨地想起了古代的英雄豪杰。到了京城，抬头看到天子宫殿的壮丽，以及粮仓、府库、城池、苑囿的富庶而且巨大，这才知道天下的广阔富丽。见到翰林学士欧阳公，聆听了他宏大雄辩的议论，看到了他秀美奇伟的容貌，同他的学生贤士大夫交游，这才知道天下的文章都汇聚在这里。太尉以雄才大略称冠天下，全国人依靠您而无忧无虑，四方异族国家惧怕您而不敢侵犯，在朝廷之内像周公、召公一样辅君有方，领兵出征像方叔、召虎一样御敌立功。可是我至今还未见到您呢。况且一个人的学习，如果不是有志于大的方面，即使学了很多又有什么用呢？苏辙这次来，对于山，看到了终南山、嵩山、华山的高峻；对于水，看到了黄河的深广；对于人，看到了欧阳公；可是仍以没有谒见您而为一件憾事。所以希望能够一睹贤人的风采，就是听到您的一句话也足以激发自己雄心壮志，这样就算看遍了天下的壮观而不会再有什么遗憾了。苏辙年纪很轻，还没能够通晓做官的事情。先前来京应试，并不是为了谋取微薄的俸禄，偶然得到了它，也不是自己所喜欢的。然而有幸得到恩赐还乡，等待吏部的选用，使我能够有几年空闲的时间，将用来更好地研习文章，并且学习从政之道。太尉假如认为我还可以教诲而屈尊教导我的话，那我就更感到幸运了。,上枢密韩太尉书
千万里的远途我好象腾云驾雾一样我去了又回来我独自一人伴随着滚滚春雷穿越东海往返真不忍心看到祖国地图变成别国的领土就即便让锦绣江山变成万劫不复的飞灰也在所不惜那浑浊的劣酒啊，哪里能排解我忧心国事所抛洒的热泪国家的救亡图存要靠的是大家群策群力就算是拼得十万将士抛头颅洒热血也要让这颠倒的乾坤大地拼力挽救回正轨,黄海舟中日人索句并见日俄战争地图
楚宣王问群臣，说:“我听说北方诸侯都害怕楚令尹昭奚恤，果真是这样吗？”群臣无人回答。江乙回答说:“老虎寻找各种野兽来吃。找到了一只狐狸，狐狸对老虎说:‘您不敢吃我，上天派我做群兽的领袖，如果您吃掉我，这就违背了上天的命令。您如果不相信我的话，我在前面走，您跟在我的后面，看看群兽见了我，有哪一个敢不逃跑的呢？’老虎信以为真，就和狐狸同行，群兽见了它们，都纷纷逃奔。老虎不明白群兽是害怕自己才逃奔的，却以为是害怕狐狸。现在大王的国土方圆五千里，大军百万，却由昭奚恤独揽大权。所以，北方诸侯害怕昭恤，其实是害怕大王的军队，这就像群兽害怕老虎一样啊。”,虎求百兽
本页内容整理自网络（或由匿名网友上传），原作者已无法考证，版权归原作者所有。本站免费发布仅供学习参考，其观点不代表本站立场。站务邮箱：service@gushiwen.org,钓鱼湾
江楼上醉饮话别橘柚正飘香，江风吹洒细雨带给小船凄凉。想象你独自远在潇湘明月下，满怀愁绪梦里静听猿啼悠长。,送魏二
枝头上，草蔓中，眼前百花盛开，有大有小，有白有红，恰如美女的香腮。可惜到了黄昏，娇艳芳香的花儿凋零，随着春风乱飞，像草草嫁出的女儿连媒人也不用。,南园十三首
本诗以“忧”贯穿全诗，作者抒发了生活的艰辛；命途的不顺；生命的衰老。首联通过描写和比喻表现了作者的百忧缠心。颈联从视觉角度与听觉角度。树上集聚的早鸦，是作者所见之景；沉闷的鼓声是作者所闻之景。又这些景物凄冷萧条，传达出作者愁闷落寞的心情。,长安夜雨
快上西楼赏月，担心中秋月有浮云遮挡，不够明朗。请美人吹笛，驱散浮云，唤出明月。月夜的天地一片清凉洁爽，刚经玉斧修磨过的月亮，又回又亮。追问月宫里独处的嫦娥，孤冷凄寂时有没有愁恨？应该有很多白发。回忆当年歌舞欢聚的情景，长袖善舞的佳人，清歌悲咽的佳人为之助兴添欢。叹明月十有八九悖人心意，总是圆时少、缺时多。愿明月如今夜常圆，人情未必总是别离。我欲化离恨为聚欢，待人归时再细细倾诉。,满江红·中秋寄远
路过钟陵，正赶上九月九日都督在滕王阁大宴宾客，事先背地里命他的女婿作一篇序以向宾客夸耀，于是拿出纸笔遍请宾客作序，大家都不敢担承。到王勃那里，竟漫不经心地接过笔来，也不推辞。都督大怒，起身假装上厕所，暗中派遣下属窥探王勃的文章，随时汇报。汇报了一两次之后，文章的语言越来越奇妙，都督兴奋地说：“这真是个天才！”连忙请他将文章全部写完，宾主尽欢而散。王勃做文章的时候，刚开始并不精密思索，先磨数升墨汁，然后大量饮酒，拉过一床被子蒙头而卧，等醒来之后，拿过笔来就写完全篇，一字不改，当时的人称王勃为“腹中写稿”。,王勃故事
赵国将要出战燕国，苏代为燕国对惠王说：“今天我来，路过了易水，看见一只河蚌正从水里出来晒太阳，一只鹬飞来啄它的肉，河蚌马上闭拢，夹住了鹬的嘴。鹬说：‘今天不下雨，明天不下雨，就会干死你。’河蚌也对鹬说：‘今天你的嘴不取，明天你的嘴不取，就会饿死你。’两个不肯互相放弃，结果一个渔夫把它们俩一起捉走了。现在赵国将要攻打燕国，燕赵如果长期相持不下，老百姓就会疲惫不堪，我担心强大的秦国就要成为那不劳而获的渔翁了。所以我希望大王认真考虑出兵之事。”赵惠文王说：“好吧。”于是停止出兵攻打燕国。,鹬蚌相争
身佩雕羽制成的金仆姑好箭，旌旗上扎成燕尾蝥弧多鲜艳。大将军威严地屹立发号施令，千军万马一呼百应动地惊天。,和张仆射塞下曲六首
自己寻访春色去的太晚，以至于春尽花谢，不必埋怨花开得太早。自然界的风雨变迁使得鲜花凋谢，春天已然过去，绿叶繁茂，果实累累，已经快到收获的季节了。,叹花 / 怅诗
湖光山色之地是我的家，槐柳树阴下小径幽幽。湖水满溢时白鹭翩翩飞舞，湖畔草长鸣蛙处处。新茬的竹笋早已成熟，木笔花却刚刚开始绽放。当年相识不见，午时梦回茶前，谁人共话当年？,幽居初夏
在猛烈狂疾的大风中才能看得出是不是强健挺拔的草，在激烈动荡的年代里才能识别出是不是忠贞不二的臣。一勇之夫怎么懂得为公为国为民为社稷的正义的道理，而智勇兼具的人内心里必然怀有忠君为民的仁爱之情。,赐萧瑀
红色的桃花还含着隔夜的新雨，碧绿的柳丝更带着淡淡的春烟。花瓣凋落家中的小童没有打扫，黄莺啼叫闲逸的山客犹自酣眠。,田园乐七首·其六 / 闲居
韵译九月九日眺望那故乡的山川，乡思归心飞越那隐约的风烟。远在他乡和大伙喝着菊花酒，身隔万里伤心望着雁飞南天。散译九月九日登上玄武山远望山河，回归故乡的心思、回归故土的热望，浓得如眼前聚集的风尘。身在别人的家乡我们一起喝下这菊花酒，我们离家万里，望着大雁飞过的天空，心中有着一样的悲伤。,九月九日登玄武山 / 九月九日旅眺
孟夏的时节草木茂盛，绿树围绕着我的房屋。众鸟快乐地好像有所寄托，我也喜爱我的茅庐。耕种过之后，我时常返回来读我喜爱的书。居住在僻静的村巷中远离喧嚣，即使是老朋友驾车探望也掉头回去。（我）欢快地饮酌春酒，采摘园中的蔬菜。细雨从东方而来，夹杂着清爽的风。泛读着《周王传》，浏览着《山海经图》。（在）俯仰之间纵览宇宙，还有什么比这个更快乐呢？,读山海经·其一
本页内容整理自网络（或由匿名网友上传），原作者已无法考证，版权归原作者所有。本站免费发布仅供学习参考，其观点不代表本站立场。站务邮箱：service@gushiwen.org,马嵬
夜气清新，尘滓皆无，月光皎洁如银。值此良辰美景，把酒对月，须尽情享受。名利都如浮云变幻无常，徒然劳神费力。人的一生只不过像快马驰过缝隙，像击石迸出一闪即灭的火花，像在梦境中短暂的经历一样短暂。虽有满腹才学，却不被重用，无所施展。姑且借现实中的欢乐，忘掉人生的种种烦恼。何时能归隐田园，不为国事操劳，有琴可弹，有酒可饮，赏玩山水，就足够了。,行香子·述怀
