fanyi,title
寒水缓缓消退，岸边留下一线沙痕。春意渐渐回临，空阔的沙洲烟霭纷纷。晴日朗照，溪边的新梅香气氤氲。数枝梅花争相吐蕊，装点新春。我独在天涯满腔怨恨，试想我现在是何等的悲怆伤神？长亭门外，群山重叠，望不断的远山遥岑，正是令人忧愁的节令时分。遥想深闺中的你，一定也是思绪纷纭。画楼的层门紧闭，春风暗暗使你的容颜瘦损。我真是对不起你啊，让你独守空闺冷衾。辜负了多少尊前花月的美景，浪费了大好青春。你可知道，我也是归心似箭，恨不得一步跨进闺门。更有多少酸甜苦辣，留着回去向你诉说详尽。可等到我们再度相逢，恐怕又要过一年光阴。,石州慢·寒水依痕
昭君即，是汉元帝时宫女。匈奴呼韩邪单于来朝时，汉元帝将昭君嫁给了单于。昭君出嫁匈奴的故事引起后人的无限感慨，屡有歌咏其命运的诗歌。至时，昭君出塞已经成了诗歌中的传统题材了，所以此诗就题材与表达的内容情感而言并无多少新鲜之处，但在剪裁与刻画技巧方面颇具匠心，仍显出与众不同之处。作者写昭君诗却不把注意力放在昭君出塞前后的一系列具体事件的叙述上，对于昭君出塞的缘由、过程以及出嫁匈奴后的生活和最终结局并不涉及，而是着重描写她离开汉宫前往匈奴途中的所见所感，从这样的角度写，更显得集中、精致。,昭君辞
传入旅舍的捣衣声，应和着孤城城头的画角，一片秋声在广阔的天地间回荡。归去的燕子向东从海上飞走，南来的大雁自空中落下，栖息在沙滩上。这儿有楚王携游兰台时感受到的惬意的凉风，有庾亮与殷浩辈在南楼吟咏戏谑时的大好月色，清风明月的景象，还都与当年一样。真是无可奈何啊！我被那微不足道的名利所羁缚，又被那难以割舍的感情所耽搁，可惜那些风流韵事都被丢到一边了。当初徒然许下功成身退时，要去求仙访道，潇潇度日的诺言。到如今，反误了我与佳人的秦楼约会。当睡梦觉来时、酒醉清醒后，我细细地思量着这一切。,千秋岁引·秋景
碧清的水面放出冷冷的秋光使人心惊，黄云在暮色中凝聚，台阶上到处是零乱破败的落叶。室内悄无人声，月光斜斜地照进来，照着他独自徘徊。又一个重阳节临近了，到处是催人的砧杵声。西窗下，开门风动竹，疑是故人来。宦海的风波，使人与人之间的情感变得非常脆弱；而仕途上的是非往往是无事生非，谁又能说得清楚。问问篱边的黄菊，不知是为谁而开？不要随便说什么愁总是跟酒在一起，酒能留住愁；其实，酒还没有醒，愁就已经先回来了。凭栏沉思了很久，月亮渐渐西沉，苍苔上已生出点点白露。,满庭芳·碧水惊秋
杜诗和韩文在愁闷时诵读，舒心爽气就像请仙女麻姑在痒处搔。天外的凤凰谁能得其精髓?世上无人懂得配制续弦胶。,读韩杜集
我的脸蜡黄，没有一点光泽，哪知道人世间的什么荣华富贵。年年都说我养蚕辛苦，为什么身上穿的是苎麻做的衣服？,蚕妇
主人摆酒今晚大家欢聚，琴师拨动琴弦助兴酒宴。明月照向城头乌鸦纷飞，寒霜降临寒风吹透衣衫。炉火暖融融华烛添光辉。艺人先弹《渌水》后奏《楚妃》。他的琴声一响万物寂静，四座无言屏气凝神倾听。奉命去远离乡关清淮，敬告大家我要归隐云山。,琴歌
春潮淹没了冶城的洲渚，落日余晖斜照在征虏亭。蔡洲新草茁壮一片嫩绿，幕府山上仍是烟霭青青。国家的兴亡取决于人事，山河也徒有险峻的地形。玉树后庭花这支亡国曲，凄婉幽怨令人不忍再听。,金陵怀古
南亭之游（参见《游南亭》）后，开始了他在永嘉境内的探奇搜胜。一方面山水并不能真正抚平他心中的幽愤，所以这一段时间中，他的诗中经常出现“倦”游的字样；然而另一方面，山水又时时给他以新的感受，使他失去平衡的心态，至少获得宣泄而趋于暂时的平衡。也就在这种徬徨徜徉中，他确立了自己山水诗鼻祖的地位，这或许是他自己始料所未及的吧。,游赤石进帆海
中秋佳节之时是月亮最圆的时候，愚蠢迟钝的老头，见识比较多，饮酒相见，现在是不应吝啬。将止的雨怎么妨碍高兴的事情？淅淅的雨，小而多的雨点。天应该有意遮拦着，拍打着人间，随便看看，美好的时光，一定要明显的不容易。直到黄昏大风起了，雨停止了，水波像金子一样闪闪发光，圆月像玉器一样皎洁。,江城子·中秋早雨晚晴
不才如我垂久老矣竟忝列先生的门下，金灿灿的酒器映照着我满头萧萧的白发。惭愧呀魏公你如此看重又宴请了我，我在曲台编的那本书消磨了几多年华。多少回重阳节从忧愁中过来的，多少回酒醉中又壮心偶发。此番风雨之夜辗转无眠，起来把新诗一遍一遍地写下。,九日和韩魏公
初冬时节，从十几个郡征来的良家子弟，一战之后鲜血都洒在水泽之中。蓝天下的旷野现在变得死寂无声，四万名兵士竟然在一日之内全部战死。野蛮的胡兵箭镞上滴着善良百姓的鲜血，唱着人们听不懂的胡歌在长安街市上饮酒狂欢。长安城的百姓转头向陈陶方向失声痛哭，日夜盼望唐朝军队打回来恢复昔日的太平生活。,悲陈陶
湖塘中长满了浮萍，姑娘们相约来到湖中，一起拨开浮萍采莲。来时，旭日初升，浦口水面上如烟的水汽，在长桨四周缭绕。采莲后回到岸上，月光已照满了高楼。好花无语，流水无情，年年都为花落春去而伤愁。明天万一西风骤然强劲，无奈莲花抵抗不住秋寒，很快就会凋落。,鹧鸪天·守得莲开结伴游
桃花盛开，垂柳依依，江南的春色很美。雨过天晴，春风温暖烟霭淡淡，让人陶醉。山峦黛绿，水波湛蓝，绿水与青山相互映衬着。歌楼酒旗飘动，招人前去。姑且把青衫典当了换酒吧。,诉衷情·小桃灼灼柳鬖鬖
有些作者擅长描写人物，虽只寥寥数笔，但因点出了人物的鲜明特征，一下子就把人物写活了。有些作者又善长于描绘景物，也不过那么三两笔，就把景物活泼泼地勾勒了下来。古代诗词中，以“游春”、“咏春”为主题的作品何止千百篇，但内容大多不外乎“伤春”“怅春”。的这首《青杏儿》好就好在不与前人雷同，风格清新，语句明白如话，以白描的手法，本色天然，流畅自然，与古代众多的游春词相比，确实可谓别有一番清新的韵味。,青杏儿·风雨替花愁
无论行走还是静坐，无论独自吟咏还是互相唱和，乃至卧倒床榻，我都独自一人；久久的站着凝望让我倍加伤神，更无奈这春寒招惹我的愁绪。这份愁情有谁曾见到，让我眼泪滚滚，把自己原先的粉妆冲洗得一丝不留；愁病交加，把灯芯挑了又挑，终究难以入眠。,减字木兰花·春怨
杭州城外望海楼披着明丽的朝霞，走在护江堤上踏着松软的白沙。呼啸的钱塘涛声春夜传入伍员庙，娇嫩的绿柳春色包蕴在苏小小家。红袖少女夸耀杭绫柿蒂织工好，青旗门前争买美酒饮“梨花”。是谁开辟了通向湖心孤山的道路？长满青草的小道像少女的绿色裙腰弯弯斜斜。,杭州春望
长乐宫与后花园正是春意盎然，嵌玉的楼台与镶金的宫殿每日都有新的赋艳词的曲。宫女歌姬只要一进入皇帝的宫门便不能再出来，宫中也就只有黄莺儿能够出外见人了。,宫词
夏日昼长，江村风日清丽，屋檐上栖息着许多小燕雀，羽翼都已长成。蝴蝶展翅停在午间的花枝上，在晴朗的天气里，蜘蛛在屋角悠然织网。月光照射在疏疏落落的帘子上，斜倚枕上，听着潺潺溪水声。久已花白的头发如今像霜雪一般白了，一直想做个樵夫或渔翁混过这一生！,夏日三首·其一
这一年暮春，长安城中车水马龙，热闹非凡，原来是到了牡丹盛开的时节，长安城里的名门大户纷纷相随前去买花。牡丹花的价钱贵贱不一，价钱多少以花的品种来定。这里的牡丹有的枝繁叶茂，鲜红欲滴，小小的束花，要付五捆白绢的价钱。它们被精心呵护着，主人还给张上了帷幕，筑起了樊篱，辛勤浇灌之余还培上了最肥沃的土，因此花的颜色还和以前一样鲜艳。家家习以为俗，更没有人认为是错的。有一个老农无意中也来到了买花的地方。目睹此情景，不由得低头长叹，然而此叹又有谁在意呢：这一丛深色的牡丹花价钱相当于十户中等人家一年的赋税了。,买花 / 牡丹
浓霜浸透了窗间的帷幕。现在正是云轻月冷，层冰未消的时候。梅花临水照镜。有人想涂抹胭脂，却学不成半点富艳妖媚之态。在朦胧的月色笼罩下，寒梅依然是玉洁清瘦的本色。想像春风中的梅花，流盼一笑，百花失色。寂寞。故乡在哪里？雪后的园林，水边的楼阁。虽然有瑶池以前的约定，但托谁捎去书信？粉蝶只懂得亲近桃柳，梅花开满了南枝却没有发现。只留下梅花在黄昏中，独自冷落伤感。,瑞鹤仙·赋梅
你到姑苏时将会看到，那儿的人家房屋都临河建造。姑苏城中屋宇相连，没有什么空地；即使在河汊子上，也架满了小桥。夜市上充斥着卖菱藕的声音，河中的船上，满载着精美的丝织品。遥想远方的你，当月夜未眠之时，听到江上的渔歌声，定会触动你的思乡之情。,送人游吴
传说古时候有一位妇女思念远出的丈夫，立在山头守望不回，天长日久竟化为石头。这个古老而动人的传说在民间流行相当普遍。这首诗所指的望夫山，在今安徽当涂县西北，唐时属和州。此诗题下原注“正对和州郡楼”，可见作于和州刺史任上。,望夫山
因为人的寿命短促，虽然临觞作乐，也只能悲歌慷慨，难以忘怀忧愁。人生在人世间，就好像早晨的露珠一样，转瞬就会逝去。时间不会重新再来，花也不可能再次开放。苹只在春天绽放光彩，兰只在秋天发出芬芳。剩下的日子苦短难耐，过去的日子让人感到苦闷惆怅。人应当及时享乐，因与友人相会而快乐，以分别而感到悲伤。哪里会没有这样的人生感触，只是因为见到我的朋友而忘却忧愁了。我的酒肴十分美好，就让自己尽情地品尝享受吧！去吟咏短歌，及时取乐，而不至于荒废岁月。,短歌行
君主一旦为美色所迷，便种下亡国祸根，用不着到宫殿长满荆棘才开始悲伤。拥有玉体的小怜进御服侍后主的夜晚，北周军队进占晋阳的战报已被传出。,北齐二首
料峭的寒风催着换上了厚衣服，到附近的郊区原野去游玩。秋风最爱多管闲事了，它一来，不但把枫叶变红，还把人的头发变白了。,野步
熙宁十年的秋天，彭城发大水，云龙山人张君的草堂，水已没到他家门的一半。第二年春天，大水落下，云龙山人搬到故居的东面。在东山的脚下，登到高处远望去，看到一个奇特的境地。于是，他便在那座山上建亭子。彭城山，山冈从四面合拢，隐约的像一个大环；只是在西面缺一个口，而云龙山人的亭子，恰好对着那个缺口。春夏两季交替的时候，草木茂盛，似乎接近天空；秋冬的瑞雪和皓月，千里一色。风雨阴晴，瞬息万变。山人养两只鹤，非常温驯而且善于飞翔。早晨就朝着西山的缺口放飞它们，任它们飞到哪里，有时立在低洼的池塘，有时飞翔在万里云海之外；到了晚上就向着东山飞回来，因此给这个亭子取名叫“放鹤亭”。,放鹤亭记
群雄“开怀痛饮”之时，显然想得远些。先强调弟兄情分再是为众人的前程的忧虑和思考。重阳节饮酒赏菊。宋江在这时候吟出“降诏”，“招安”自然为英雄们的悲剧打下了伏笔。宋江将时光催人老的恐慌，轻松消解进了佳节带来的神清气爽，这是一种暴风雨来临前的平静。,满江红·喜遇重阳
第一句是对菊花的描写。轻肌、弱骨这样的字眼，带有一定的拟人色彩，主要是诗人的主观感情的外射。葩，就是花。这一句从肌、骨，一直写到花本身，是全面的概述。,赵昌寒菊
紧窄的窗户，小巧的窗纱，拓露出一方视野的空间。窗外飘打过多少阵风雨，而梨花还是那样的耀眼。不须说客灯前黯然的心绪，孤枕畔旅居的伤感，我的思念总是飞向很远很远。太多的清愁催出了三千丈的白发垂肩，再久的繁华不过是春梦一现。忽然间，我发现居民家飘出一缕缕轻烟，从杨柳树两边升起，渐渐爬上了高耸的屋檐。,折桂令·客窗清明
碧海波平无险阻，瑶台有路可通行。细思量，当初就该双飞去。想当时，轻别意中人，现如今，山高水远何处寻。灰尘落绮席，烟雾锁香闺。写好的书信，如何送给你。登高楼极目望远方，萧萧细雨洒梧桐，天已近黄昏。,踏莎行·碧海无波
晓妆只粗粗理过，唇边可还得点一抹沉檀色的红膏。含笑未唱，先露一尖花蕾船的舌尖，于是樱桃小口微张，流出了婉转如莺的清歌。到了场下的酒会，就又娇爽多了。小盅微啜似乎还不够过瘾，换过深口大杯拚醉，哪在意污湿罗衣？最传神的是，笑嚼着红嫩的草花，向心上人唾个不停。,一斛珠·晓妆初过
诗贵自然，“咏物以托物寄兴为上”（清·薛雪《一瓢诗话》），托物寄兴亦以自然为绝妙，自然天成是咏物诗的至境。作诗主张自然成文，反对用奇语异辞，认为“眼前景物口头语，便是诗家绝妙辞”（《答友人论诗》）。所以，他的诗大都写得自然清新，颇多天机自动天籁自鸣机趣。他的咏物诗也大多是“眼前景物口头语”的自然流露，并不刻意追求寄托，只是在有意无意之间托物寄兴，借景言情，似无寄托而寄托遥深，更是精彩绝妙，不同凡响。,咏菊
回忆汴京往昔的繁华，万里山河都属于帝王之家。奢华的宫殿园林，弦管笙琶的声音日夜不断。花城早已是空寂无人、萧索冷落，虽然身处黄沙漫天的胡地，那繁华如春的汴京仍然时常萦绕在梦中。家乡在何处，怎么忍心听到那羌笛吹奏凄凉彻骨的《梅花落》。,眼儿媚·玉京曾忆昔繁华
公元1163年（宋孝宗隆兴元年），以枢密使都督江淮东西路军马，主持抗金军事，表示庆贺。次年，陆游任镇江通判，张浚以右丞相、江淮东西路宣抚使，仍都督江淮军马，视师驻节，颇受知遇；张浚旋卒，年底宋金和议告成。公元1165年（乾道元年）夏，陆游调任隆兴（治所在今江西省南昌市）通判；二年春，以“交结台谏，鼓唱是非，力说张浚用兵”的罪名，被免职归家。这首词就是这一年归家不久后写下的。另有两首词意思与此词大体相同，也是同时所写下的。,鹧鸪天·懒向青门学种瓜
西施是越国溪边的一个女子，出身自苎萝山。她的魅力过去今天都在流传，荷花见了她也会害羞。她在溪边浣纱的时候拨动绿水，自在的像清波一样悠闲。确实很少能见她笑起来露出洁白的牙齿，一直像在碧云间沉吟。越王勾践征集全国绝色，西施扬起娥眉就到吴国去了。她深受吴王宠爱，被安置在馆娃宫里，渺茫不可觐见。等到吴国被打败之后，竟然千年也没有回来。,西施 / 咏苎萝山
请问春天从这去，何时才进长安门。托付给你还乡梦，恳请带我回家园。,零陵早春
我家注在西秦，开始只是靠小小的随身技艺维持生活。在吟词唱曲上别出新裁，翻新花样。我偶然学得了念奴的唱腔，声调有时高亢能遏止住行云。所得的财物不计其数。没辜负我的一番辛劳。数年来往返于咸京道上，所挣得的不过是一些剩洒冷饭。满腹心事，该向何人去诉说？若得知音赏识，我不会拒绝为他唱那些最难最高雅的歌曲。唱完一曲后我在酒宴上当众落下泪来，再次拿起罗帕掩面而泣。,山亭柳·赠歌者
早年曾吟诵《愁赋》之类的名篇，如今，悄悄的私语声又传来耳畔。夜露浸湿黄铜闪闪的门环，苍苔盖满石块雕砌的井栏--到处都可以听到你的歌唱，仿佛在倾诉人间的悲愁哀怨。闺中少妇思念丈夫长夜无眠，起身寻找机梭为他织就御寒的农衫，伴着她的只有屏风上曲折的山峦，夜凉如水，又怎样度过这深秋的夜晚？听，细南又在散打西厅的窗棂，伴着捣衣的砧杵，你的声音似断实连。在客居的宾馆迎来深秋的长夜，在出巡的高官凭吊故国的月圆。还有其他无数类似的伤心惨事，象《豳风·七月》，都可即席成篇。可笑的是竹篱外传来灯笼笑语--少年男女在捉拿蟋蟀，兴趣盎然。呵，假如把这所有的音响尽皆谱入琴曲，那一声声，不知能演奏出多少人间的哀怨！,齐天乐·蟋蟀
希望天地的神灵都赐福，因为皇帝敬慕他们。皇帝兴建了紫色的坛宇作为专门祭神的场所，想找寻与神相通的办法。皇帝专心一意、恭敬地继承前代祭祀天地的重任，使神灵和乐。把刺绣品画成黑白相间的斧形图案，遍挂于祭坛之上，用隆重的仪式来承奉至尊的神灵。把六十四个童子排成八行八列跳舞以娱乐天神太一。音乐一起响起，琴、竽、瑟、美玉做成的磬和金鼓并陈杂奏，希望神灵能够得到娱乐，百官济济，都恭敬地向神灵祭祀。他们恭敬地献上丰盛的牺牲和供品，又焚烧香草和动物脂油以请神下降受享。神留下受享，虽然历时很久，但从天上看来，那只是片刻。只见神鸟在前面发出光芒，神赏赐皇帝以寒暑准时不失，阴阳和顺，以彰显君主的德行。朗诵的诗歌合于音律发出玉器般的鸣声，音乐中具备了五个音阶——宫、商、角、徵、羽。这美妙的音声达到远处，使凤鸟飞翔，神灵久留足以享用这些祭祀。,天地
世上记事的书籍虽然很多，但学者们仍然以“六艺”——《诗》、《书》、《礼》、《乐》、《易》、《春秋》等经典为征信的凭据。《诗经》、《尚书》虽有缺损，但是记载虞、夏两代的文字都是可以见到的。尧将退位，让给虞舜，还有舜让位给禹的时候，都是由四方诸侯长和州牧们推荐出来的，于是，让他们先试着任职工作，主持事务数十年，做出了成就，建立了功绩，然后再把大政交给他们。这是表示天下是极贵重的宝器，帝王是最大的统领者，把天下移交给继承者就是如此的困难。然而，也有人说过，尧要把天下让给许由，许由不肯接受，以为是一种耻辱而逃走隐居起来。到了夏代的时候，又有卞随、务光等人。这些人又为什么要受到称许呢？太史公说：我登过箕山，相传山上有许由之墓。孔子依次评论古代的仁人、圣人、贤人，对吴太伯和伯夷等讲得很详细。我听说许由、务光等节义品德至为高尚，而经书中有关他们的文辞却一点儿也见不到，这是为什么呢？孔子说：“伯夷、叔齐，不是老记着人家以前的过错，因此怨恨他们的人就少。”“追求仁德而得到仁德，又有什么可怨恨的呢？”我对伯夷兄弟的用意深感悲痛，但看到那些逸诗又感到诧异。他们的传记说道：,伯夷列传
胡人吹起羌笛响在戍楼之间，戍楼之上景象萧条月光幽闲。借问悠悠的落梅乐曲有几首？长风万里吹拂一夜洒满关山。,和王七玉门关听吹笛 / 塞上闻笛
秋雨停了，梧桐树叶不再滴雨，好像是停止了它滴滴的眼泪。重新反复回忆，释放自己的情怀。想当初曾与思念之人有过美好的风流往事。（回忆）那美丽的身影、如桃花般的面容，但人已离去（可是人却不知何处去了,浣溪沙·雨歇梧桐泪乍收
花山寺是因鲜花繁多、美丽而得名，来到这里才发现，不见鲜花，只见杂草丛生。鲜花栽种的培养和修枝很重要，要勤奋努力，要知道，花是很容易凋零的，而杂草却是很容易就蔓延生长的。,题花山寺壁
⑴梅花：指汉乐府横吹曲中的《梅花落》。⑵桂树：指西汉淮南王的门客小山作的《招隐士》，其首句为“桂树丛生兮山之幽”。,杨柳枝词九首
慈乌失去了它的母亲，哀伤的一直哑哑啼哭。早晚守着旧树林，整年都不肯飞离。每天半夜都哀哀啼哭，听到的人也忍不住泪湿衣襟。慈乌的啼哭声仿佛在哀诉着自己未能及时尽到反哺孝养之心。其他各种鸟类难道没有母亲，为什么只有慈乌你特别哀怨？想必是母恩深重使你承受不住吧！以前有位名叫的人，母亲去世竟不奔丧。哀叹这类的人，他们的心真是禽兽不如啊！慈乌啊慈乌！你真是鸟类中的啊！（注：曾参是孔子弟子中以孝心孝行著称的门生。）,慈乌夜啼
某年某月某日，潮州刺史派遣部下军事衙推秦济，把一只羊、一头猪，投入恶溪的潭水中，送给鳄鱼吃，同时又警告它：古时候的帝王拥有天下后，放火焚烧山岭和泽地的草木，用绳索去网捉、用利刃去刺杀，以除灭虫、蛇等那些给人民带来危害的动物，并把它们驱逐到四海之外去。到了后世，帝王的德行威望不够，不能统治远方，于是，长江、汉水之间的大片土地只得放弃给东南各族；更何况潮州地处五岭和南海之间，离京城有万里之遥呢？鳄鱼潜伏、生息在此地，也就很自然了。当今天子继承了大唐帝位，神明圣伟，仁慈英武。四海之外，天地四方之内，都在他的安抚统辖之下。更何况潮州是大禹足迹所到过的地方，是古代扬州的地域，是刺史、县令治理的地区，又是交纳贡品、赋税以供应皇上祭天地、祭祖宗、祭神灵的地方呢？鳄鱼是一定不可以同刺史一起生活在这块土地上的！刺史接受天子的任命，镇守这块土地，治理这里的民众，而鳄鱼竟敢不安分守己地呆在溪潭之中，占据一方吞食民众、牲畜、熊、猪、鹿、獐，来养肥自己的身体，繁衍自己的后代，与刺史抗衡，争当统领一方的英雄。刺史虽然驽钝软弱，又怎么能向鳄鱼低头屈服，胆怯害怕，给治理百姓的官吏丢脸，并在此地苟且偷安呢？而且刺史是奉天子的命令来这里当官的，他势必不得不与鳄鱼讲明道理。鳄鱼如果能够知道，可要听刺史我的话：潮州这地方，大海在它的南面。大到鲸鱼、鹏鸟，小到虾子、螃蟹，没有不在大海里归宿藏身、生活取食的。鳄鱼早上从潮州出发，晚上就能到达大海。现在，刺史与鳄鱼约定：至多三天，务必率领那批丑陋的同伙南迁到大海去，以躲避天子任命的地方官；三天办不到，就放宽到五天；五天办不到，就放宽到七天；七天还办不到，这就表明最终不肯迁徙了。这就是不把刺史放在眼里，不肯听他的话。不然的话，就是鳄鱼愚蠢顽固，虽然刺史已经有言在先，但还是听不进，不理解。凡对天子任命的官吏傲慢无礼，不听他的话，不肯迁徙躲避，以及愚蠢顽固而又残害民众的牲畜，都应该处死。刺史就要挑选有才干有技能的官吏和民众，操起强硬的弓弩，安上有毒的箭镞，来同鳄鱼较量，一定要把鳄鱼全部杀尽才肯罢手。可不要后悔啊！,祭鳄鱼文
你们走远了，我倒也不再惦念；及至归期接近，反而难、以忍耐。儿女们已站在眼前，你们的容貌我已认不出来。欢喜到了极点，不知说什么好。收泪一笑，包含着多少悲哀。明知这不是在梦中，可我的心仍在摇摆不踏实。,示三子
我独自站在空阔无边的钟山上饮酒，天色已晚，天气变寒，已经到了回去的时候。曾几何时，我们一起踏雪寻梅，现在又依依惜别。你离开后，我将会有怎样的一番思念。长江西岸的白石岗，长满了萋萋芳草，惹来一片离愁。我对你的思念不用山鸟来表达，就像桃李不会言语，下面却自己出现了小路。,一剪梅·游蒋山呈叶丞相
这首诗的作者热情地塑造出一个襟怀嵚崎磊落，慷慨豪勇，报恩酬知己，不畏死难的剑客形象，借以寄托自己的人格理想。谓志陵山岳，气吞江海，撼人心魄。,剑客
近日门前溪水涨，情郎几度，偷偷来相访，船儿小，无法挂上红斗帐，不能亲热无计想，并蒂莲下空惆怅。愿妾身为红芙蓉，年年长在秋江上，再愿郎是花下浪，没有障碍与阻挡，随风逐雨，时时来寻访。,渔家傲·近日门前溪水涨
