fanyi,title
东陵侯被废弃以后，往司马季主那儿去占卜。季主说：“您要占卜什么事呢？”东陵侯说：“躺卧时间长了就想起来，闭门独居久了就想出去，胸中积闷久了就想打喷嚏。我听说：积聚过多就要宣泄，烦郁之极就要开畅，闷热太甚就会起风，堵塞过分就会流通。有一冬就有一春，没有只屈而不伸的；有一起就有一伏，没有只去不来的。我私下有所怀疑，希望得到你的指教。”季主说：“既然这样，那么您已经明白了，又何必要占卜呢？”东陵侯说：“我未能深入理解其中的高深微妙，希望先生能指点究竟。”季主于是说道：“唉！天道和什么人亲？只和有德的人亲。鬼神怎么会灵？靠着人相信才灵。蓍草不过是枯草，龟甲不过是枯骨，都是物。人比物灵敏聪明，为什么不听从自己，却听命于物呢？而且，您为什么不想一下过去呢？有过去就必然有今天。所以，现在的碎瓦坏墙，就是过去的歌楼舞馆；现在的荒棘断梗，就是过去的琼花玉树；现在在风露中哀鸣的蟋蟀和蝉，就是过去的凤笙龙笛；现在的鬼火萤光，就是过去的金灯华烛；现在秋天的苦菜，春天的荠菜，就是过去的象脂驼峰；现在红的枫叶，白的荻草，就是过去的蜀产美锦，齐制细绢。过去没有的现在有了，不算过分；过去有过的现在没有了，也不能算不足。所以从白昼到黑夜，盛开的花朵凋谢了；从秋天到春天，凋萎的植物又发出新芽。激流旋湍下面，必定有深潭；高峻的山丘下面，必定有深谷。这些道理您也已经知道了，何必还要占卜呢？”,司马季主论卜
牡丹香，牡丹香。黄金色的花蕊与红玉般的花瓣一同绽放，千片红色花瓣就像天边的云霞一样烂漫，上百红花挂在枝头就像灯烛般明耀。照映着地面就像刚刚打开的红锦缎一样，在风中没有结出兰麝囊。（与牡丹一对比）仙人的花树也显得单调无色，王母娘娘的桃花则是又小又无香。花上残留的露水轻盈使牡丹泛起紫色的艳光，（牡丹）在朝阳的照耀下泛着红光。红色和紫色深深浅浅交相辉映正面和反面万种形态在俯仰间依次显露出来。衬着绿叶多情的隐藏娇羞的面容，无力地卧在花丛中像美人带着醉妆。（牡丹如美人一般）时而带着低低地娇笑好像掩起了口，时而凝神思量埋怨情人如同断肠。牡丹你的芳姿和高贵的色彩一定是奇绝的，其他的杂卉乱花都不能相比，石竹花金钱花何其细碎，芙蓉花芍药花实在寻常。于是王公贵族和官卿士子，每日来游赏牡丹的冠盖拥挤相望。矮车软辇的是高贵的公主，香衫宝马的是豪门公子。卫公宅静静地闭起北院，西明寺深开了北廊，游戏的双飞蝶看人日久，黄莺的残啼一声春日还长。一起发愁花期将过，依然张着帐幕垂下阴凉。花开花落共二十日，一城的人都为它痴狂，三代的文人争相称颂，人心重视外貌的华丽不重视内质，重视外貌的华丽一直到牡丹，它是由有来的并非今天独有。元和天子心忧农桑，怜悯治下百姓感动上天使上天降下吉祥。去年的好稻谷生出九个穗，可田中冷清没有人去。今年的好稻谷分出两穗，君王的心独自高兴没有人知道。没有人知道，可曾叹息。我希望暂时有造物主一样的魔力，减少一些牡丹妖艳的颜色。稍稍的改减一些卿士的爱花心，让他们和我们君王一样心忧农业。,牡丹芳
在端午节这天，围在岸上的人们，惊怕地观看着群龙在水上嬉戏，不知道原来这是装饰成龙形的小船，船上彩旗猎猎作响震纪空中翻飞，敲响的锣鼓喧闹，清清的水流。从古到今的冤魂不散，楚国的风俗至今仍存。闲暇的日子正适合在江亭喝酒聚会，诵读《离骚》，哪觉得其中的忧愁。,午日观竞渡
长亭，秦汉时，在驿道边隔十里置一亭，谓之长亭，是行人歇脚和饯别的地方。绿槐烟柳，槐者，怀也；柳者，留也。槐柳荫成，如烟笼雾罩，显示出一片迷茫、怅惘的伤离恨别的氛围。就在这槐柳如烟，长亭连短亭的驿道上，多少人临歧洒泪，次第分离！,青玉案·绿槐烟柳长亭路
你曾经就任西畿县县令，三年下来，马不生膘。为偿还高筑的债台，只好把佩剑卖了，任满还乡时，也仅仅是满载车书而归。现在冒着边关风雪远游朔方，衣衫单薄，难御寒风。此去就住在灵州的一个角落，每日早上可以听到报晓的号角，平时也没有什么客人来往。,送邹明府游灵武
有点凉的深秋之夜，又一个老头悠闲自在。吹灯后迟迟才躺下睡觉，秋雨声中渐渐入眠。火盆的火已经灭了，加点火，烤烤被子。早上天晴了有些寒冷不想起，看看窗外树叶霜打成红的了。,秋雨夜眠
春风是什么时候到来的呢？已经吹绿了湖泊上面的山峰。湖泊上面的春意既然早来，种田的人民整天都闲不下来。农民拿着耒耜在田间劳作，修沟引水铲除杂草躬耕不缀，傍晚时分农民将牛喂饱后，回到家里把门关上睡觉去了。,题农父庐舍
华山顶上的高松，玉立亭亭凌霜傲雪。天生的百尺长松，岂能为小的狂风所折?而桃李却与长松不同，它们所卖弄的是艳丽的美色，使行路之人为之着迷。当春光已尽之时，它的碧叶就化成了黄泥。希望君要学长松，切记不要作桃李。受屈而忠心不改，然后才能辨别谁是真君子。,赠韦侍御黄裳二首
回忆昔日洛阳酒商呈糟丘，为我在天津桥南头造酒楼。花黄金白璧买来宴饮与欢歌笑语时光，一次酣醉使我数月轻蔑王侯将相。天下多少贤士豪杰与立德立言高尚之人，我只与您是心心相印成莫逆之交。这种友情在山回海转前也不会为难或改变，为此献出全部心血倾泻全部情感也在所不惜。我到淮南去隐居待仕，您留在洛阳愁苦生梦相思不已。您我不忍相别，依旧相随而行。相随而行迢迢万里，访问随州仙城山，那儿有三十六案溪流回环萦绕，走向每一案溪流都见干万朵鲜花盛开，干条万条山望都松树耸立轻风吹拂。登银鞍挽金络来到平川大地，汉东太守亲来相迎。紫阳真人，邀您我吹笙作乐。餐霞楼上仙乐鸣响，嘈然宛转如同凤凰啼鸣。长袖善舞管乐吹奏催人轻举起舞，汉东太守乘醉手舞足蹈跳起来。他手持锦袍披及到我身上，我酒醉枕在他的大腿上酣眠。意气风发上凌九霄，整天饮酒之后便又如星离似的两地分别了。您我相隔关山分手山遥水远。我回到故山寻找旧日家园，您也归家渡过了渭桥。您家父辈勇武如狼如虎，任并州长史遏制戎虏的进犯。您我五月间相约穿越太行山，羊肠小道上车花催人困乏却不言苦。来到北都太原之地岁月久长，为您的贵信义轻黄金深受感动。豪华之筵青玉盘上盛放琼杯美食，使我既醉且饱暂无归心。时常出游来到城西弯曲之路，晋祠之旁流水长淌如同穆玉。乘用划水鸣响箫鼓，微波荡漾如龙鳞闪闪万草碧绿。情兴一来携歌伎带舞女来到此处，那纷纷扬扬的杨花如似雪花飘洒。傍晚日斜之时红妆歌舞女个个欲醉，来到水边那百尺清潭映出她们效好的容颜。初月升起辉映翠娥与婵娟，美人们换唱新曲罗衣舞动。清风徐来欢歌飞上空中，歌声嘹亮宛转绕云而飞。如此时光的世间行乐难以再遇，我又西游向朝廷献上《长杨赋》。朝堂中青云直上难以期望，于是辞归回还东山。渭南侨头又与您相遇一面，即刻在酂台之北又相离分手。您问我离愁别恨今有多少，请看那暮春时节落花纷纷最为相似。说也说不尽满怀心绪难以表述。呼儿伏跪封上信函结束此书，寄给您千里之外的遥遥相思与祝福。,忆旧游寄谯郡元参军
花飞卉谢，叶茂枝繁，朋友出了京城，暮云中的楼阁又映衬着帝京的繁华，古今之情都在其中。远行之人切莫听这宫前的流水，流尽年华时光的正是此种声音。,暮春浐水送别 / 一作暮春送客
一望无垠的沙滩上，潮水涌上来了，像一道白色的长虹；我猜想，是不是瑶台仙人，失手把玉杯中的琼浆泼向了人间，如此奔腾汹涌。澎湃的潮水中，蓝天的倒影在水里颠簸摇动；夕阳西坠，浮沉出没在湍急的洪波巨浪中。,十七日观潮
红牡丹的绿叶在悄悄地舒展，红牡丹的花色有鲜有暗。面临凋零，牡丹愁肠欲断，请问春光，你可懂得牡丹所想？,红牡丹
一个驿站又是一个驿站，驿骑疾驰有如流星一般，黎明时分从那长安出发，傍晚已经越过陇山之颠；陇水声声令人不忍去听，呜呜咽咽多么使人愁烦。一路风沙尘土扑满马汗，晨昏雾气露水打湿衣衫，那西方驰来了谁家男儿，自说是新近里立功封官，上月间从安西启程出发，一路上不停留急把路赶。都护现在尚未到达驻地，出发时还在那西州旁边，十天间越过了浩瀚沙漠，狂风吹起沙土从早到晚。战马行走在那碎石道上，四蹄磨出鲜血洒在路间。置身万里之外报效朝廷，自己并无任何追求贪恋。并非不知边塞艰难辛苦，岂是为了妻子儿女打算。边塞山口明月正在升起，月光先已照上高高城关。溪水声声伴着松涛阵阵，在静夜里飕飕刮过耳边。离家之仿只靠归梦排解，关山塞外离忧萦绕心间，愿与为友携手同赴国事，不愁那前方的征途漫漫。,初过陇山途中呈宇文判官
来到荆州客旅，到今天已经一个多月了，月亮也变换三次姿势——上弦下弦，如同小船来回荡。现在北风正紧，树木落叶萧萧，出门在外不容易，想回家了。山外的太阳是那么遥远，江上的天空是如此空旷，没有依靠的感觉真不是好滋味。洞庭湖水使人着迷，秋归的大雁也乘着云雾来到潇湘洞庭。这里幽静清旷，是个修真养性的好地方，我的爱好经历多年也没有改变。人生百年，变化万千，绵绵不断。此行既没有寻找到仙人，也没有感受到舜帝灵魂的昭示。沧海桑田，你可见到海水变浅？你可见到王母的仙桃已经成熟了三回？一回就需要经历三千年！仙人在那里？找你找得太辛苦，扪胸倚剑，仰天长叹，顾影自怜。我仍然要游走遍大地，游遍江河湖海，做个自由的隐士，濯足沧浪。,郢门秋怀
戴红巾报时官手执更筹报晓，更衣官才给皇帝送上翠云裘。九重的皇宫打开了金红宫门，万国的使臣都躬身朝拜皇帝。日光初照遮阳的掌扇在晃动，香烟缭绕黄袍上面绣龙飘浮。早朝结束还须为皇帝写诏书，佩玉叮当回到凤凰池头。,和贾舍人早朝大明宫之作
北斗七星高挂在西楼，寂寞的金屋只有萤火流动。月光即使照到长门宫殿，恐怕在凄凉的深官后院，也只是会生出许多哀愁。桂殿哀愁的生活，长久得已记不得多少年。屋内四壁，已积起秋的尘埃。夜里青蓝的天上高挂着镜子一样的明月，只照射着长门宫里那孤寂的情怀。,长门怨二首
做官做到将相，富贵之后返回故乡，这从人情上说是光荣的，从古到今都是这样啊。大概士人在仕途不通的时候，困居乡里，那些平庸之辈甚至小孩，都能够轻视欺侮他。就像苏季子不被他的嫂嫂以礼相待，朱买臣被他的妻子嫌弃一样。可是一旦坐上四匹马拉的高大车子，旗帜在前面导引，而骑兵在后面簇拥，街道两旁的人们，一齐并肩接踵，一边瞻望一边称羡，而那些庸夫愚妇，恐惧奔跑，汗水淋漓，羞愧地跪在地上，面对车轮马足扬起的灰尘，十分后悔，暗自认罪。这么个小小的士人，在当世得志，那意气的壮盛，以前的人们就将他比作穿着锦绣衣裳的荣耀。只有大丞相魏国公却不是如此，魏国公，是相州人士。先祖世代有美德，都是当时有名的大官。魏国公年轻时就已考取高等的科第，当了大官。全国的士人们，听闻他传下的风貌，仰望他余下的光彩，大概也有好多年了。所谓出将入相，富贵荣耀，都是魏国公平素就应有的。而不像那些困厄的士人，靠着侥幸得志于一时一事，出乎庸夫愚妇的意料之外，为了使他们害怕而夸耀自己。如此说来，高大的旗帜，不足以显示魏国公的光荣，玉圭官服，也不足以显示魏国公的富贵。只有用恩德施于百姓，使功勋延及国家，让这些都镌刻在金石之上，赞美的诗歌传播在四面八方，使荣耀传于后世而无穷无尽，这才是魏国公的大志所在，而士人们也把这些寄希望于他。难道只是为了夸耀一时，荣耀一乡吗？魏国公在至和年间，曾经以武康节度使的身份来治理过相州，便在官府的后园建造了一座“昼锦堂”。后来又在石碑上刻诗，赠送给相州百姓。诗中认为，那种以计较恩仇为快事，以沽名钓誉而自豪的行为是可耻的。不把前人所夸耀的东西当作光荣，却以此为鉴戒。从中可见魏国公是怎样来看待富贵的，而他的志向难道能轻易地衡量吗？因此能够出将入相，辛勤劳苦地为皇家办事，而不论平安艰险气节始终如一。至于面临重大事件，决定重大问题，都能衣带齐整，执笏端正，不动声色，把天下国家置放得如泰山般的安稳，称得上是国家的重臣啊。他的丰功伟绩，因此而被铭刻在鼎彝之上，流传于弦歌之中，这是国家的光荣，而不是一乡一里的光荣啊。我虽然没有获得登上昼锦堂的机会，却荣幸地曾经私下诵读了他的诗歌，为他的大志实现而高兴，并且乐于向天下宣传叙述，于是写了这篇文章。尚书吏部侍郎、参知政事记。,相州昼锦堂记
天马从西方极远之处来到，经过了沙漠之地。众多的少数民族和外国都降服了。天马出自水中，长有双脊，皮毛颜色像老虎一样。天马能变化，如同鬼神那样灵异。天马穿越千里，迅速越过无草的区域，在辰年来到东方。将驾着天马，高飞到遥远的地方，无可限期。天马既来，开通了上远方之门，可以上昆仑山去会神仙了。天马既来，龙也将来，可以乘着龙登天门，去观赏上帝住的地方了。,天马二首·其二
宋朝人欧阳晔治理鄂州政事时，有州民为争船互殴而死，案子悬了很久没有判决。欧阳晔亲自到监狱，把囚犯带出来，让他们坐在大厅中，除去他们的手铐与脚镣，给他们吃食物。吃完后，善加慰问后再送回监狱，只留一个人在庭院中，这个人显得很惶恐不安。欧阳晔说：“杀人的是你！”这个人假装不知道，欧阳晔说：“我观察饮食的人都使用右手，只有你是用左手，被杀的人伤在右边肋骨，不是你是谁？”这个人无言以对。,欧阳晔破案
本页内容整理自网络（或由匿名网友上传），原作者已无法考证，版权归原作者所有。本站免费发布仅供学习参考，其观点不代表本站立场。站务邮箱：service@gushiwen.org,菩萨蛮·寄女伴
我是伯庸的后代啊，是正直诚信的。我的始祖是古帝高阳氏啊，楚怀王与我同根相连。我秉受正气而生啊，生辰合道起了美名。我的名字与天地相齐啊，光辉灿烂如同群星。我吸天地精华吐出浊气啊，身处浊世也决不苟合求容。我行为忠诚刚直不阿啊，于是遭谗害被弃置不用。君王听信假话贬斥忠良啊，不理睬我反顺从邪恶奸佞。我心怀愤恨满腔怒火啊，我心遭压抑失去平衡。心神恍惚啊君王不与我同心，孤独冷落啊君王不同我亲近。我辞别君王心灰意冷啊，低吟悲歌在泽畔水滨。先贤遭祸身危难啊，依然竭尽忠信一片诚心。众谗人嘁嘁喳喳抑人扬己啊，君王何不昭示我的真情！当初我们曾在庙堂约好啊，如今却听信谗言中途变心。我怀揣兰蕙和衡芷啊，却被抛弃荒野不用。怀念故土高山声声哀叹啊，思恋祖国家乡满怀愁情。我本想找机会自能竭尽忠心啊，怎奈道路堵塞幽暗不通。面目黧黑人憔悴啊，身老力衰没精神。阵阵冷风吹动我的裙裳啊，浓浓寒露打湿我的衣裙。奔赴湍急的长江和湘水啊，顺随波涛向下漂行。我慢步徘徊在山窝啊，山风阵阵回旋凶猛。驾起我的车啊向玄石山奔驰，让我的马儿啊在洞庭山慢步徐行。黎明我从苍梧山出发啊，傍晚我投宿在石城山顶。荷花车盖菱花车啊，紫贝楼台白玉厅。薜荔为装饰美玉做卧席啊，五彩的上衣，洁白的裙裳。登上逢龙山向下眺望啊，离开故都道路多么漫长。想起那郢都的风物习俗啊，一夜之间九转愁肠。波高流急茫茫一片啊，浪涛翻滚奔向东方。心惆怅止不住的思念啊，精神郁闷一天天倍觉神伤。霜露一片白茫茫啊，秋风急吹萧萧响。身随水流不回返啊，灵魂远逝愁难当。尾声：就像那奔腾的江水，轰轰隆响啊。风卷大波浪翻滚，浩浩荡荡啊。大风鼓荡，波浪起伏，撞击巨石啊。打着旋涡，盘旋冲击，水流终究被阻挡啊。时逢浊世遭凶险，终获罪愆啊。留下清词丽句美篇，传于来世后人观。,九叹
本页内容整理自网络（或由匿名网友上传），原作者已无法考证，版权归原作者所有。本站免费发布仅供学习参考，其观点不代表本站立场。站务邮箱：service@gushiwen.org,绝句漫兴九首·其四
事情的发展必定会有一定的结局，道理有它原本就该如此的规律。天下只有表现冷静的人，才能从细微之处预见到日后将会发生的显著变化。月亮周围出现了晕圈预示着将要刮风，房屋的石柱返潮湿润预示着将要下雨，这是人人皆知的事。人事的发展变化，情理和形势之间的因果关系，也是空疏渺茫难以尽知，千变万化而无法预先料到的，怎么能和天地阴阳的变化相比？即便是贤能的人对此也有所不解。这是什么原因呢?这是由于喜爱和憎恨扰乱了他们的内心，利害关系又影响了他们的行动啊!从前山巨源见到王衍，说：“将来给天下百姓带来灾难的，一定是这个人!”郭汾阳见到卢杞，说：“这个人一旦得志，我的子孙就会被他杀得一个不留!”现在分析一下他们所说的话。其中的道理是可以料想到的。依我看来，王衍之为人，从容貌和谈吐上，确实具备了欺世盗名的条件。但是他不妒忌别人，不贪图钱财，只是随大流。如果晋朝当时没有惠帝这个昏君，当政者即使只是一个中等的君主，就算是有成百上千个王衍这样的人，又怎能扰乱天下呢?卢杞那样的奸诈，确实足以败坏国家。但是他不学无术，容貌不足以动人，言谈不足以蒙蔽社会，如果不是遇到德宗这样的鄙陋昏庸的君主，又怎能受到重用呢?由此说来，山、郭二公对王、卢二人所作的预言，也未必完全如此啊!现在有人嘴里背诵着孔子、老子的话，亲身实践着伯夷、叔齐的行为，收罗了一批追求名声和不得志的士人，相互制造舆论，私下里互相标榜，以为自己是颜渊、孟轲再世，然而他们为人阴险狠毒，和一般人的志趣不同。这是把王衍和卢杞合成一个人了。他在社会上酿造的祸害还能说得完吗?脸面脏了不忘洗脸，衣服脏了不忘洗衣，这本是人之常情。现在他却不是这样，身穿奴仆的衣服，吃猪狗的食物，头发蓬乱得像囚犯，表情哭丧着像家里有人去世，却在那里大谈《诗》《书》，这难道说是人的真实的心情吗?凡是办事不近人情的，很少不成为大奸大恶之辈，竖刁、易牙、开方就是这样的人。此人借助当世享有盛名之力，来促成他尚未形成气候的祸患。虽然有励精图治的君主，敬重贤才的宰相，也还是会选拔并重用他的。这样，他将成为天下的祸患，是必定无疑的了，这就不只是王、卢二人所能比拟的。孙子说：“善于用兵的人，并没有显赫的功勋。”如果这个人没有被重用，那么我的话就有些过头了，而此人就会有怀才不遇的感慨。谁又能知道祸患会达到上述这种地步呢?不然的话，天下将要蒙受他的祸害，而我也会获取卓有远见的名声，那就太可悲了!,辨奸论
远山一片青翠，湖面就如白娟般光洁，每走一步都都如同一幅山水画。去寻访的梅花仙鹤，再去苏堤游玩。把西湖美景都游个遍。明月高高升起天色已晚，回路还远也都不去管它。向前行水和船儿啊不要转头，对着如此美景，酒可不要斟浅了。,西湖杂咏·春
自从我来到黄州，已度过三个寒食时际。年年爱惜春光想将它挽留，春天自管自归去不容人惋惜。今年又苦于连连阴雨，绵延两个月气候萧瑟一如秋季。独卧在床听得雨打海棠，胭脂样花瓣像雪片凋落污泥。造物主把艳丽的海棠偷偷背去，夜半的雨真有神力。雨中海棠仿佛一位患病的少年，病愈时双鬓斑白已然老去。,寒食雨二首
本页内容整理自网络（或由匿名网友上传），原作者已无法考证，版权归原作者所有。本站免费发布仅供学习参考，其观点不代表本站立场。站务邮箱：service@gushiwen.org,首夏山中行吟
石头城群山依旧，环绕着废弃的故都；潮水如昔，拍打着寂寞的空城。淮水东边，古老而清冷的圆月，夜半时分，窥视这昔日的皇宫。,金陵五题·并序
《阮郎归》又名《宴桃源》、《醉桃源》、《碧桃春》等，此词咏其本意。典出汉刘晨、阮肇遇仙之事，此调常用来写冶游、艳遇，这首词也是如此。,阮郎归·渔舟容易入春山
皓月当空，月轮的万顷光波，扫射整个宇宙，世界一片澄明透彻。醉后跨上玉龙遨游太空，遨游八极。当仙女们在凉爽的水晶宫殿里轻歌曼舞的时候，人世间却正经历炙热酷暑之苦。还需化费多少风露，才能驱散炎暑，换得人间的清凉呢？,清平乐·纤云扫迹
20岁时，就在家乡历夸参加了抗金起义。起义失败后，他回到南宋，当过许多地方的长官。他安定民生，训练军队，极力主张收复中原，却遭到排斥打击。后来，他长期不得任用，闲居近二十年。这首词，抒写了他梦寐以求、终生不变的抗敌救国的理想，抒写了壮志不酬的悲愤心情。,破阵子·赠行
高入云天的玉楼，奏起阵阵笙歌；随风飘来宫嫔的笑语，与它伴和。月宫影移，只听得夜漏单调嘀嗒；卷起水晶帘来，我似乎靠近银河。,宫词五首·其二
晚唐女子宿醉初醒带着离别的愁绪慢慢整理环形发髻，轻如蝉翼的衣服让身子有一点点寒冷，慵懒地照着镜子涂口红穿翠衣。装着蚕丝袜和装饰金莲花头饰，如雪肌肤在薄薄的纱衣下仿佛是玉石般润泽，在沉香与檀香的氛围下露出杨柳小纤腰婀娜的身姿。,浣溪沙·宿醉离愁慢髻鬟
让黄莺呜叫也叫不完，让呢喃的燕子任意地诉说，也说不清。这一点孤独愁苦，十年萦绕心头从未间断，这愁苦搅乱春风。旧地重来妻子却再也看不见。但小楼东边的杨柳，却依然如旧。曾记得你我共同在粉壁题诗，而今墙壁残破诗句无影无踪。长满兰草的沼泽地，新涨起一片碧绿溶溶，凋落的红花含着遗恨翻腾。看身上已经穿得破旧的春衫，清楚地记得这是当年送别时，你在灯下连夜剪裁制成。折磨我的是无边无际的思念之苦，算起来，往事像云烟一样，从眼前经过一切总是成空。在暮色中仰望楚天漫无边际，只能靠着阑干目送远去的飞鸿。,木兰花慢·莺啼啼不尽
“一饷疑情无语”，显然不是终日无语、整日销凝而是忽然间因触景生情而产生的惆怅。从次句看，很可能是因攀折梅花所致。这情形有类于《西洲曲》“忆梅下西洲，折梅寄江北”，从忆梅到折梅，引起对远人的怀思有一个从无意到有意的过程。折梅与怀人有关，所来自远，南朝刘宋时赠诗云：“折梅逢驿使，寄与陇头人。江南无所有，聊赠一枝春。”故次句言“手捻梅花何处”，其意仍在怀思远人。“何处”二字则有欲寄无由的苦恼，故“手捻”梅枝，彷徨徘徊。,如梦令·一饷凝情无语
